,date,rating,review,developerResponse.body
37,2020-06-25 21:33:40,5,I really love this app. It helps me to calm down and relax and get to sleep. With what’s going on in the world today it’s hard to silence the mind but Meditopia helps tremendously. I also want to say thank you to Meditopia for starting using more culturally diverse icons.,"Thank you so much for your wonderful comment :) It is great to hear that meditation helps you calm down and rest the mind which is nearly impossible in these chaotic days. Hope you keep enjoying with soothing and insightful meditation experiences. Wish you a great day! All the best, İpek - Member Happiness"
38,2019-04-26 07:58:07,5,This is my first time using this app today and I have a feeling it’s going to help to change my life signifanctly!! Please you yourself a favor and spend the five bucks a month and meditate!,"So great to see your comment! Thank you for sharing with us. Wish you great meditations! Take care, All the best, Seher - Member Happiness"
39,2021-02-03 23:11:21,5,Would definitely recommend I smoke and meditate and I immediately feel better they have a lot of good options to choose from,"Hello! We are so happy to hear that meditating makes you feel better! Meditation is a great way to reduce stress and as their stress levels decrease, most people feel less need for smoking. We would suggest you to give a chance and try if this would work for you too. Hope you keep discovering the best meditations for yourself! All the best, Ezgi- Member Happiness"
40,2018-05-09 13:26:59,5,"This app is changing my life one 10 minutes daily mediation at a time. I highly recommend it to those who are just entering this journey. You feel comfortable, at ease, and incredibly guided.",
41,2020-03-25 00:47:10,5,"This is the most peaceful app I have ever used it helps me sleep,breath,and feel safe. I recommend this app to people who have trouble sleeping and many more this app is truly amazing","Hello, it is great to hear that you like Meditopia :) If you have any questions, you can always reach us via hello@meditopia.com, we are ready to help! Hope you enjoy with wonderful meditation experiences. All the best, İpek - Member Happiness"
42,2020-09-04 04:22:57,5,"Ive been very stressed and anxious especially with online school and medical issues I have and I just started and I feel great alot of my stress, pain, and anxiety has gone away","Hello, we are so happy to accompany your life journey. Meditation is a great way to reduce stress. Hope you keep meditating with us and experience all the benefits of meditating! Stay safe and healthy. Best regards, Ezgi- Member Happiness"
43,2019-10-26 00:27:46,5,"Very soothing, calming and relaxing. After a shower, I love listening and letting go of today’s work in my mind. I have so much on my mind, which consists of worries, doubts, anger, frustration and more.","Great to hear you can let go all those feelings with meditation! Doing meditation regularly makes big difference on both mind and body. If you have any questions, you can always reach us via hello@meditopia.com Wish you nice day! All the best, Seher - Member Happiness"
44,2020-06-19 13:30:00,5,"I use the app first thing in the morning . I meditate and it helps me start my day . Great way to do it, as I see the results during my journey. I love it","Hello, thank you so much for your comment. This is incredible to see the effects of daily meditation practice in your life. First of all, it means a self-observing aspect that is open with meditation. We are so happy to accompany your mornings with our content, beginning a new day. Hope you keep enjoying :) All the best, İpek - Member Happiness"
45,2019-08-01 06:47:51,5,The only way I can get to sleep at night! I love the courses they have and I love the voices they have. Nice music and very relaxing! I’m super glad I’ve discovered this app ☺️,"So happy to read your comment :) Thank you for sharing. Wish you great meditations! All the best, Seher - Member Happiness"
46,2020-02-11 01:38:21,4,"I got this on my apple watch and it keeps making me put my password in! I love the app and all but my watch keeps vibrating to put the password in! You people are killing me. Fix your system, yet it is STILL here.","Hello, it is great to hear that you liked Meditopia!  I hope you will have very relaxing, calming, and soothing meditation experiences with a lot of insight. For your questions about the app, you can always reach us via hello@meditopia.com, we are waiting to help you! All the best, İpek - Member Happiness"
47,2019-07-17 17:32:19,1,"I decided to do a trial run of only $1 for a month, because I was starting to love the App! But after the moth expired I was charged $64 (WITHOUT MY PERMISSION), not only that but when trying to get a refund they were unable to help me... I even sent them an email which they did not respond. 
I am truly disappointed because as said before I was loving the app but it turned out being a complete money scam.","Hello, hope you are having a great day! Could you please check your mails? We respond every mail in latest 24 hours. As I see, you have registered to ""30 days $1 then the yearly membership starts"" promotion. After one month, since you haven't cancelled, yearly membership has started. You can get the refund , no worries. I hope you continue doing meditation. All the best, Seher - Member Happiness"
48,2020-10-13 13:23:53,1,"I haven’t used Meditopia for a while but have found myself in need of it. I was a public beta tester for iOS 14 and it seems this app is not functioning for iOS 14.2. I go to a meditation, it gets stuck on the loading symbol and never plays. Here is what I’ve done so far:

- Power cycle of phone. 
- Airplane mode 30 seconds to reset network connectivity. 
- Force close of the Meditopia app. 
- Uninstall/reinstall Meditopia. 

No change with any of those steps. I did notice when I go to start a meditation, the volume graphic appears even though the volume buttons have not been touched. Please help with this app.","Hello, we would like to thank you for the elaborative review. Can you please reach us through hello@meditopia.com? As Meditopia team, we continue to renew the app with appropriate content and technical improvements in line with the suggestions and feedback from our members. We would be happy to get your feedbacks. Have a great day! All the best, Ezgi- Member Happiness"
49,2019-07-17 04:47:09,5,It’s a great app! I sleep a lot better and enjoy taking at least 10 minutes out of my day to just sit down and meditate,"Thank you so much for sharing your comment. It is really great to read it :) Take care! All the best, Seher - Member Happiness"
50,2020-01-27 02:15:18,5,I love this app it works great. Whenever I’ve had a long day the sleep meditation puts me right to sleep!,"Hello, it is great to hear that Meditopia helps you sleep well! If you have any questions, you can always reach us via hello@meditopia.com, we are ready to help you. Hope you enjoy! All the best, İpek - Member Happiness"
51,2020-08-27 12:37:53,5,Just want to say that the motivational messages everyday are just amazing. They are so thought out and really speak to me. Thank you for this.,"Hello, I am so happy to know that you enjoy the daily inspirations! As Meditopia team, we are trying to reflect our philosophy of life through these notifications and spread mindfulness as much as we can. Keep safe and healthy, and motivated! Best regards, Ezgi- Member Happiness"
52,2020-06-18 13:54:28,5,"The sleep meditations are great, it has helped me so much.
I have fibromyalgia which also causes sleepy problems, since I use Meditopia it had get so much better.","Hello, I am really glad to hear that Meditopia has helped you cope with your sleeping difficulties. Wish you a great day! Best regards, Ezgi- Member Happiness"
53,2020-07-01 22:00:12,5,Love this app so much! So glad I spent the money for a monthly subscription. Compared to all other meditation apps this one is by far the best!!!,"Hello, that's great news! I'm glad you loved Meditopia . We know we are the best but it is really nice to hear that from you!:) Hope you keep enjoying our meditations and other content. Best regards, Ezgi- Member Happiness"
54,2020-02-13 06:05:13,5,Me and my sister couldn’t sleep so then I got an add of this app we fell asleep like babies it was the best and her voice is so smoothing and calming I just love this app,"Hello, it is great to hear that you were able to sleep better with Meditopia. I hope you will have very relaxing, calming, and soothing meditation experiences with a lot of insight. If you have any questions, you can always reach us via hello@meditopia.com, we are always ready to help. Hope you enjoy! All the best, İpek - Member Happiness"
55,2021-02-14 00:46:01,5,"My sleeping problem have been solved with this application, this is very useful and great meditation app, I wish there was more free options 😁","Great to hear that! Meditation brings us piece and a better relaxation experience. Hope you keep enjoying :) We have both free and paid subscriptions. You can listen unlocked meditations without any payment. Moreover, if you share the app with your friends, you can gain 2 weeks gift Premium membership. All the best, İpek - Member Happiness"
56,2020-05-27 06:24:40,3,"Ok so I can see this working...but I signed in with my email and accidentaly signed out but I tried to put in my email again and it said email take.... just saying they should also add a sign in and not just a sign up
Overall Im feeling #relaxed","Hello, thank you so much for your precious comment! It is great to hear that you see how meditation works and feel relaxed. I hope you keep enjoying. There are different options to try the app with or without a membership via e-mail. When you register with an e-mail, then you can log in with that address to the same membership. In order for us to help you by seeing the details, please reach us via hello@meditopia.com. All the best, İpek - Member Happiness "
57,2020-06-21 23:47:36,5,I have tried many apps but none matches the quality and variety of Meditopia. It is well worth the money.,"First of all, thank you so much for sharing your positive thoughts with us. It is great to hear that you feel it is worth to have Meditopia as the road friend in your journey. Hope you keep enjoying all the content :) Have a great day! All the best, İpek - Member Happiness"
58,2020-02-24 17:32:31,5,"This app is easy to use, simple, and full of quality benefits when starting out with meditation.","Hello, it is great to hear that you liked Meditopia. I hope you will have very relaxing, calming, and soothing meditation experiences with a lot of insight. If you have any questions, you can always reach us via hello@meditopia.com, we are always ready to help. Hope you enjoy! All the best, İpek - Member Happiness"
59,2020-03-29 08:45:05,1,"Ever since I started listening to this and trying to use it to fall asleep to my feet just randomly started hurt. I know this sounds weird but when ever I even just think about my feet, they just start to hurt, but not like a stinging pain it hurt inside my foot. This happened right after I used meditopia. Can anyone at least tell me what it is.","Hello, it is great to hear that you are interested in Meditopia. I hope you will have very relaxing, calming, and soothing meditation experiences with a lot of insight. A pain might have multiple meanings in one's personal story. For your questions, you can always reach us via hello@meditopia.com, we are always ready to help. Hope you enjoy! All the best, İpek - Member Happiness"
60,2020-02-18 16:47:34,5,"You can choose to get notifications for inspiration. It helps with sleep, relaxation, and meditation.","Hello, it is great to have you with us in Meditopia! I hope you will have wonderful meditation experiences. If you have any questions, you can always reach us via hello@meditopia.com, we are always ready to help. All the best, İpek - Member Happiness"
61,2020-02-01 20:16:32,5,I tried the first session and it’s so relaxing! If your reading this I recommend it if your under a lot of stress. Very helpful! ❤️🥰,"Hello, it is great to hear that you liked Meditopia. I hope you will have very relaxing, calming, and soothing meditation experiences with a lot of insight. If you have any questions, you can always reach us via hello@meditopia.com, we are always ready to help. Hope you enjoy! All the best, İpek - Member Happiness"
62,2020-08-02 12:36:29,5,Thank you! I didn’t know the benefit of such apps until I started to use it.,"Hello, how great it is to know that we have such happy members! Hope you keep meditating with us and keep sharing the outcomes. Best regards, Ezgi- Member Happiness"
63,2020-05-12 16:27:21,5,I use this app all the time and I go to sleep very fast at night. And u can use this anytime u want 2 use it.,"Hello, thank you very much for your interest in Meditopia! As we give ourselves time and space, we begin to experience all the transformative effects of meditation. I wish you discover the meditations that will be best to you. All the best, İpek - Member Happiness"
64,2020-08-24 21:50:33,5,I've tried all meditation apps and meditopia is the deepest and most impactful one out there. One of very few apps I use daily.,"What a wonderful comment! We are so happy to hear that you use meditative content on a daily basis with Meditopia. We hope all the content will bring you relaxation, joy, and insight.  Please reach us via hello@meditopia.com if you have any questions. Have a great day! All the best, İpek - Member Happiness"
65,2020-06-18 04:18:59,5,I never thought an app would help me meditate.  have never done it till now.  I will keep doing it this app is amazing.,
66,2020-07-08 11:42:26,5,This app makes meditation flow easily into your life. It’s subtle and relaxing. You’ll love it.,"Hello, that's one of our aims to make it easy for everyone to practise meditation. How happy we are if we succeeded! Thank you so much for pointing that out. Have a great day! Best regards, Ezgi- Member Happiness"
67,2020-09-10 17:52:56,5,This app is amazing it helps so so much I recommend to get this app it does wonders you wouldn’t believe it,"Hello Lilly, I am so glad to hear that you are interested in meditation and you benefit greatly from Meditopia! We would love to know more about your experiences. If you want to share your experience with us, you can join our testimonal page.
 Have a great day! Best regards, Ezgi- Member Happiness 
https://meditopia.com/testimonial/
"
68,2020-06-16 14:08:44,5,"I love Meditopia!!! It really causes me to relax my mind, body, soul and spirit!!! It allows me to be calmer, relaxed, think clearer and it relieves stress and tension!!! It really helps me to fall asleep peacefully and faster... This app is awesome!!!","Excellent news! We are happy to hear that meditation helps you for a better emotional regulation, for finding body & mind balance, and for relaxation. I hope you will continue finding the meditations responding best to your needs. Wish you a great day :) All the best, İpek - Member Happiness"
69,2020-08-14 00:42:59,5,No I feel able to improve as human being!!!,"Hello Dani, I am so happy to hear that! I hope you find the best meditations for yourself and keep practising with us! Best regards, Ezgi- Member Happiness"
70,2020-03-11 10:39:07,5,This app really helps! I’m more focused and I don’t feel stressed out all day while I’m at school.,"Hello, it is great to hear that you like Meditopia :) If you have any questions, you can always reach us via hello@meditopia.com, we are ready to help! Hope you enjoy with wonderful meditation experiences. All the best, İpek - Member Happiness"
71,2020-09-07 02:27:38,5,On those days this app really helps me. Stressed about school and work? Use this app. 100% recommend!,"Hello, I am really glad to hear that you benefit from Meditopia! We are all in a very chaotic time with a lot of uncertainty. Meditation is an experience that has positive effects on our stress management both in the short term and in the long term. Hope you keep meditating with us! Best regards, Ezgi- Member Happiness"
72,2020-02-22 06:22:19,5,The app is presented amazingly and I especially love all the developer responses I saw on reviews. It’s really nice to see responses like that.,"Hello, it is great to have you with us in Meditopia :) If you have any questions, you can always reach us via hello@meditopia.com, we are ready to help! Hope you enjoy with wonderful meditation experiences. All the best, İpek - Member Happiness"
73,2019-12-12 12:00:41,5,"Listened to a lot of Apps ! The narrator is the best, very peaceful! The background sound is perfect! The meditation guidance is great! I start every morning here!","Hello, it is great to hear that you like Meditopia and want it to be a part of your life! I hope you will enjoy the app and you will have the most relieving and relaxing meditation experiences. All the best, İpek - Member Happiness"
74,2020-06-29 16:13:40,5,I’ve had Calm and Sleep. But the woman’s voice is very soothing I love it the most and it’s the one I would recommend.,"Thanks a million for this incredible comment! We are so happy to hear that you find Meditopia relaxing and helpful for your meditation journey. I hope you keep enjoying. Wish you a great day. All the best, İpek - Member Happiness"
75,2019-11-29 15:27:15,5,The title called it,"Great news! We are very happy to hear that you liked Meditopia. I hope you will have wonderful meditation experiences. All the best, İpek - Member Happiness"
76,2020-04-20 18:24:11,5,This is a great app for me too relaxed thank u for putting a ad on my screen :),"Hello, thank you very much for your interest in Meditopia! As we give ourselves time and space, we begin to experience all the transformative effects of meditation. I wish you discover the meditations that will be best to you. All the best, İpek - Member Happiness"
77,2020-02-25 06:15:12,1,You are forced to sign up with Facebook and then you are repeatedly directed to pages you don’t want but they make it impossible to move past.  Very frustrating - and all this for a few!!,"Hello, it is great to hear that you liked Meditopia. I hope you will have very relaxing, calming, and soothing meditation experiences with a lot of insight. We have three options via Facebook, Apple, and e-mail. If you have any questions, you can always reach us via hello@meditopia.com, we are always ready to help. Hope you enjoy! All the best, İpek - Member Happiness"
78,2020-02-27 04:11:47,5,This app is so good with helping you sleep my doughtier latterly goes to sleep before her bed time.,"Hello, it is great to hear that you like Meditopia :) If you have any questions, you can always reach us via hello@meditopia.com, we are ready to help! Hope you all enjoy with wonderful meditation experiences. All the best, İpek - Member Happiness"
79,2020-06-18 08:29:01,5,Really helped me sleep better and have more comfortable sleep mentally,
80,2018-06-09 05:49:15,5,"I liked the voice of the girl, who is talking on this app.",
81,2020-06-28 01:21:29,5,Love how the have they different meditation for all type of situations,"Hello, thank you so much! I hope you discover the most helpful meditations for yourself. Best regards, Ezgi- Member Happiness"
82,2020-08-31 12:48:13,5,Very helpful to my morning routine,"Very good news :) It is one of the best ways to start a day with feeling refreshment in your body and mind. Hope you keep enjoying all the content. Take care! All the best, İpek - Member Happiness"
83,2020-02-29 02:30:55,5,It’s great for making me and you feel sleepy,"Hello, it is great to hear that you liked Meditopia. I hope you will have very relaxing, calming, and soothing meditation experiences with a lot of insight. If you have any questions, you can always reach us via hello@meditopia.com, we are always ready to help. Hope you enjoy! All the best, İpek - Member Happiness"
84,2020-05-06 14:38:31,2,"I think it’s wonderful, but the price tag to have this subscription is really expensive. Don’t know if I can  afford it.","Hello, thank you so much for your interest! We have both free and paid subscriptions. You can listen unlocked meditations without any payment. Moreover, if you share the app with your friends, you can gain 2 weeks gift Premium membership. All the best, İpek - Member Happiness"
85,2020-06-17 21:07:21,5,Hands down the best meditation app I’ve ever tried.,"Thank you so much! This made us really proud. Have an amazing day. Best regards, Ezgi- Member Happiness"
86,2020-06-16 14:59:42,5,Best mediation app I’ve ever used. Even bought the yearly subscription. Worth it,"Hello, thank you so much for your interest in Meditopia. We are happy to hear that you decided meditating for a year. If you have anything to ask,  you can always reach us via hello@meditopia.com. Wish you a great day! All the best, İpek - Member Happiness"
87,2020-08-08 17:18:57,5,This app help you feel less streased they sgow you diffrent ways and tequinches to releave stress. And its free!,"Hello! Meditation is an experience that has positive effects on our stress management both in the short term and long term. Thank you so much for pointing this out and keep meditating with us! Best regards, Ezgi- Member Happiness"
88,2020-05-10 19:55:54,3,Let me meditate your so distracting on all meditations in the there’s never a long pause in none of your meditations you irritate me,"Hello, thank you very much for your interest in Meditopia! As we give ourselves time and space, we begin to experience all the transformative effects of meditation. We have less guided and deeper series too. Moreover, you can meditate with non-directive music. I wish you discover the meditations that will be best to you. All the best, İpek - Member Happiness"
89,2020-01-26 02:04:19,5,So fun,"Hello, it is great to hear that you liked Meditopia! I hope you will have very relaxing and soothing meditation experiences. If you have any questions, we are always ready to help you via hello@meditopia.com. Wish you a great day! All the best, İpek - Member Happiness"
90,2018-04-17 06:55:26,5,Calming beautiful voice.,
91,2020-06-16 12:48:42,5,It’s been a wonderful help for my personal growth,"Hello, it is great to hear that meditation is part of your journey to self-awareness and self-compassion. We are happy to have you among us. If you have any question to ask, you can always reach us via hello@meditopia.com. Take care! All the best, İpek - Member Happiness"
92,2021-01-21 11:24:10,1,My friend sent me a link that promised a month of premium access if I install the app. No promised premium whatsoever! Scammers! Should be deleted from the apple store! Will delete it immediately and do not recommend this to anyone!,"Hello!  In order for you to use the 30-day free trial, you must have downloaded Meditopia for the first time using the sent link. Can you please reach us through hello@meditopia.com? We would like to fix this for you and we would be so happy if you'd join us for a month. Hope you keep meditating! All the best, Ezgi- Member Happiness"
93,2020-06-19 03:38:35,5,Use this app morning and night for mental health,"First of all, I wish you a great day. Thank you for sharing your comment with us :) It is perfect to have a daily meditation routine especially for beginning and ending your day. Hope you enjoy! All the best, İpek - Member Happiness"
94,2020-01-05 00:11:15,5,Most relaxing thing on earth,"Hello, it is great to hear that you have relaxing meditation experiences with Meditopia! If you have any questions, you can always reach us via hello@meditopia.com. I hope you enjoy. All the best, İpek - Member Happiness"
95,2020-12-16 19:19:44,5,It was great but I just love peopleShouldn’t have to pay for the premium,"Hello! Thank you so much for your feedback! We would love you to have unlimited meditation experience with us. You can have free access to Premium content by sharing the app with your friends. Please reach us through hello@meditopia.com if you need any assistance. Have a great day! All the best, Ezgi- Member Happiness"
96,2019-11-12 18:54:21,5,These exercises are helping me so much,"Hello! Very good to hear from you! I hope they will help much more. Wish you great meditations. All the best, İpek - Member Happiness"
97,2020-10-29 10:16:21,5,This is by far my favorite app for meditation.,"Hello! We know we are the best!:) Thank you for your kind feedback. It is great to know that you are enjoying your meditation journey with us. Hope you find the best meditations for yourself and keep practising. Have an amazing day! All the best, Ezgi- Member Happiness"
98,2020-05-01 22:39:14,1,"They’ve been illegally withdrawing funds from my account. I deleted my account a week into a 60 day free trial. They’ve charged me every month and they refuse to refund my mo Wu. They’re in imstanbul turkey so they apparently don’t have to abide by US laws. DO NOT DOWNLOAD, THIS IS A SCAM!","Hello, it is great to hear that you are interested in meditation. In order for us to see your membership details, you can always reach us via hello@meditopia.com, we are ready to help! All the best, İpek - Member Happiness"
