,date,rating,review,developerResponse.body
0,2020-07-07 22:44:10,5,"I had a wonderful 2018, but mid 2019 my world shifted dramatically, and everyone knows how 2020 is going. My heart aches for my old self. I would cry seeing photos of me being happy because I knew I wasn’t the same person I was before. My passions have vanished, and I felt like a shell of who I used to be. I have done almost 20 meditations so far. I am learning a new skill which is helping me learn how to stop my (negative/anxious) thoughts, and stories I tell myself (which never happen), and I just listen to the woman talk and follow her directions in regard to where my attention should be. The sleep meditations have me asleep before she gets deep into the story with is only 15 minutes long! I am starting to finally feel like I am not suffocating in my life and can breathe again... Thank you...","Hello, we are all in a very chaotic time with a lot of uncertainty. Life is always full of ups and downs. Our feelings are temporary as everything else in life. Awareness and acceptance of this feelings may create bigger differences in ourselves than we ever expected. Reading your story was really heart-warming. Thanks for sharing with us! Best regards, Ezgi- Member Happiness"
1,2020-07-09 10:01:22,5,"This app has brought a new meaning of gratitude. I have come to a place of learning what works for my life and what does not. This Meditopia app has assisted me in my transition of change with a peace of mind and heart for the greater good of my sanity/health. I was once a Christian who never left out of the prism’s of her mind. Placing restrictions on God himself with religion. I receive the healing the universe has to offer. I have awaken my spirit to live and not suffocate and die. To release negative energy and to focus on positive energy. Meditation through meditopia is one of Gods greatest gift to  regenerate our very being of existence from our head to the very souls of our feet (like regenerating a cell). I had forgotten the basics the simplicity of health and wellness, so I encourage people to use the Meditopia app!","Hello, thank you so much for profoundly sharing this amazing experience with us. That's our pleasure to accompany you in this special journey. Hope you keep meditating with us and keep sharing your precious views. Best regards, Ezgi- Member Happiness"
2,2020-06-17 03:15:08,5,"Never in 1 million years did I think I would meditate, I didn’t even know what meditation was. This app was recommended to me by a coworker, I have always been a little bit high strung and it was starting to affect my health relationships and even work performance. Reluctantly I sat down listen to the lady on the app and followed along long story short, I have not missed a day in the past 5 months, I meditate daily, my life has improved drastically in all parts. Health, relationships with others and work performance,And I attribute a lot of that to finding this app and doing the work that is recommended it was an accident that I found it but I am glad I did thank you made it over yet","What a profound comment! We don't always have these life changing moments in life that open a new door, a new perspective, and a new self-understanding. We are so lucky to hear that you had one of these moments with a touch of a friend! Hope you will keep creating a special time and space for yourself. We are so excited to be with you in this journey :) If you need anything, you can always reach us via hello@meditopia.com. All the best, İpek - Member Happiness"
3,2020-08-02 13:45:00,5,"I’ve used three or four of the other popular meditation apps, and found one or two to be very helpful. For example, Headspace was responsible for helping me establish a regular 10 minute per day practice that I have maintained faithfully every day for the past five years. 

I supplemented my meditation with other apps from time to time. And recently I discovered Meditopia. I like this app best of all. Mostly because of the combination of soothing music that has a special quality I’ve not found elsewhere, and the quality of the woman’s voice that guides the meditation. 

There’s something about the blend of music, voice, and the words she uses, that make this meditation the most enjoyable and most relaxing of all the apps I’ve tried. 

So there several really good ones, but this is the best in my opinion. Of course, my opinion is just one perspective. You’d have to try it and come to your own conclusions based on your unique preferences. 

But, if you’re looking for a good meditation app to try, this one is worth checking out for sure.","Hello Ernie, thank you so much for this uplifting comment! As an experienced user in meditation apps, your views are really valuable for us. Meditation is a very personal/unique experience and it is not always easy to find what works best for you. I am really happy that you found what is best for you and that you found it with us! Hope you keep meditating with us. Please reach us through hello@meditopia.com if you would like to share more about your journey. Best regards, Ezgi- Member Happiness"
4,2020-03-03 12:07:14,5,I work night shift and on my days off it’s very hard for me to fall asleep before 6 am. I found this app last week & tried the free sounds they really knocked me out within like 5 minutes. I did pay for the upgrade so I could get a variety of sounds and not play the same ones over but so far it’s my own type of melatonin. I stopped taking melatonin a few months ago and this has been a life saver. I passed it on to some fellow night shift nurses so hopefully they’ll have the same experience as I did.,"Hello, it is great to hear that you liked Meditopia. I hope you will have very relaxing, calming, and soothing meditation experiences with a lot of insight. If you have any questions, you can always reach us via hello@meditopia.com, we are always ready to help. Hope you enjoy! All the best, İpek - Member Happiness"
5,2020-03-21 14:39:46,5,"I have tried every app I could find on meditation. I don’t have issues sleeping but getting good sleep is the problem. With the voice guidance in combination with the relaxing sounds, I was able to relax and really feel the difference. I can’t wait to try some of the other sounds. If you are looking for a meditation app that actually works and helps you, this is it. Thank you so much to the developers and people who made this app.","Hello, it is great to hear that you had better sleep quality with Meditopia. I hope you will have very relaxing, calming, and soothing meditation experiences with a lot of insight. If you have any questions, you can always reach us via hello@meditopia.com, we are always ready to help. Hope you enjoy! All the best, İpek - Member Happiness"
6,2020-06-20 11:25:30,5,I’ve tried several meditation apps but this is by far the best. I love the soothing voice and cadence of the speaker for the daily meditation. I find the special series to be timely and lightning. And I love the variety of the special series. I have never been one to stick to meditating but I have now meditated 90 days with this app. Can’t say enough about the work they put into it as well as the motivational boost I get from it.,"Wow 90 days is an amazing dedication! I am glad to hear that you enjoy Meditopia. Thank you very much for joining us! Best regards, Ezgi- Member Happiness"
7,2019-04-17 08:19:07,5,"Honestly, I’m very thankful for the creation of this app! I’ve been stressed recently and woke up every morning feeling horrible, but upon using this app, I’ve never felt fresher or more energized to start the day! Not only that, but the voice of the woman is very soothing and professional! What’s great is that you learn to balance between free usage of the app, and paid features. Which, I will do. Just amazing!","Your sharing really made us happy and motivated one more time. Thank you so much :) Take care! All the best, Seher - Member Happiness"
8,2020-01-25 04:11:53,3,"It’s nice but some people just want free sleep, meditation, or advice... and this app gives those things to you, but not for free, I would prefer an ad, then like an option to go no ads, or have a subscription for more deeper features, but no. Almost everything is locked, and I’m not willing to pay. Now on to the good, what is unlocked is fabulous. It helps you meditate and sleep. I’ve been way more calm since I got the app. Please respond by taking my suggestion. If you did your rating of 4.8 might go up to 5👍😀","Hello, it is great to hear that you liked Meditopia and got better listening meditations! Thank you so much for your precious suggestion. We will be working on that. We have both free and paid memberships. If you share the app with your friends, you can gain 2 weeks gift Premium membership. If you have any questions, you can always reach us via hello@meditopia.com, we are ready to help you! All the best, İpek - Member Happiness"
9,2020-08-25 14:40:44,5,"As someone who has tried literally EVERY meditation app available, some even choosing the premium rates, Meditopia is hands down the BEST! This app has something for everyone. I love the soothing voice of the lady talking you through the meditations, the soft music playing in the background as well as the content of the meditation choices. Well done Meditopia! I am so thankful to have found you.","Thank you very much for sharing your precious feelings and thoughts with us :) We are so grateful to hear these from a member who experienced various meditations. Hope you keep meditating and discovering your inner self! We are more than happy to accompany you in this splendid journey. Take care! All the best, İpek - Member Happiness"
10,2020-05-22 09:02:50,5,"Love this app!! I can finally fall asleep quicker and stay asleep. I love the different sleep sessions. I haven’t explored much other sessions but look forward to it. 
Only con is there aren’t often enough new sleep sessions!! Would love more on the reg 
Overall love it and would highly recommend it for anyone starting meditation and continue meditation","Hello, thank you so much for your interest in Meditopia! As we give ourselves time and space, we begin to experience all the transformative effects of meditation.I hope you will have very relaxing, calming, and soothing meditation experiences with a lot of insight. If you have any questions, you can always reach us via hello@meditopia.com, we are always ready to help. Hope you enjoy! All the best, İpek - Member Happiness"
11,2020-07-05 21:03:43,5,I suffer from anxiety and have been on meds for a couple of years now. This app has been the best medication so far I’m off my meds now and when I feel overwhelmed I take a couple of minutes to myself and pick a session according to how I’m feeling at the moment feel 100 times better when I’m done!,"There are times illnesses and medication hide a difficulty we have in our internal world. It is great to hear that now you have comfort with meditation practice, rather than experiencing mental states as bodily reactions. Hope you keep enjoying all the content :) All the best, İpek - Member Happiness"
12,2019-03-31 23:39:40,5,I used to meditate and I left it while back. It’s wasn’t until I found someone to brought me back into this. I’m glad he did. I feel so much better when I take this meditation and drive my day to be more successful and to be more in control of myself.! You guys are awesome this application is so great I will share it with friends.! Thank you,"You made us so happy with your comment :) Thank you for sharing. If you need anything, you can always reach me via hello@meditopia.com Have a great week! All the best, Seher - Member Happiness"
13,2020-06-17 21:00:19,5,"Meditation has always been something I wanted to try “when I had time.” Working remotely during this pandemic brought me the time, but I hadn’t realized the stress such uncertainty in my daily life would bring. Meditopia is helping to mitigate that stress and has demonstrated other benefits as well.  I’ve been at it 3 weeks now and looking forward to continuing.","Hello, it is great to know that you are now actively spending time for yourself. We are so happy you found us in this stage of your life. Please keep in mind that we are always beside you as Meditopia team in this challenging times. Wish you a great day. Best regards, Ezgi- Member Happiness"
14,2020-01-17 13:24:31,5,"Great app for sleeping or just a quick unwind.   Works like a charm and I have insomnia, so this is a blessing. Several different topics you can pick and choose from depending on yours needs at that moment. I've tried many of these types apps and this is, by far, superior than all of them. Highly recommend.","Hello, it is great to hear that you liked Meditopia! We thank you so much for this precious comment. I hope you will enjoy the app while getting more and more help for a better sleep. If you have any questions, you can always reach us via hello@meditopia.com. All the best, İpek - Member Happiness"
15,2019-11-13 16:06:49,5,I can’t believe this worked I thought this was a prank but it really worked first I was having problems on school nights because I did not want to go to sleep and I wanted to stay up all night so then I downloaded this app and then it just became easier to sleep and I became really sleepy at that point,"So great to hear your news! Sleeping is very important for one self and meditation supports sleeping by balancing the nervous system. Wish you great sleeps! All the best, Seher - Member Happiness"
16,2019-02-22 08:13:20,5,"I just started using this app and I am addicted.
I’ve been suffering depression and anxiety since 3 years ago, I stopped taking my antidepressants since a month ago. My life just changed a lot with this 2 steps! I can wait to continue using this app and feel completely happy and mentally healthy!!!","Such a wonderful news! So happy for you :) Thank you for sharing. I really hope you will enjoy every of your meditation. Wish you a great weekend! All the best, Seher - Member Happiness"
17,2020-03-24 22:37:55,1,"This seems probably a personal preference, but I find the female voice pretty disturbing and at times even creepy and unsettling.
I find this somehow relates to sexism and gender bias in machine/ human-imitating voices like with Echo, Alexa, Siri for instance, that somehow female voices are assumed to be more soothing, therapeutic, servient, helpful etc. - it’s not. 
I just don’t understand why there isn’t a male version to all the wonderful audios that I’m listening to with their wonderful content. Or even, a variety of voices from where I can choose. I hate the current voice. Please change this for the wider audience.","Hello, it is great to hear that you are interested in meditation :) Thank you so much for your suggestion. We have a live team that is composed of the people who are specialized on meditation experience. If you have any questions, you can always reach us via hello@meditopia.com, we are ready to help! Hope you discover the meditations that are best for you. All the best, İpek - Member Happiness"
18,2020-06-16 12:48:28,5,"It’s helps me when I’m down, unfocused or even in determined. Do yourself a favor and take 15 minutes to check out for yourself. I would’ve started meditating years ago if I knew the strengths in the practice as well as it’s strengthning my spiritual as well as physical self.","What a profound comment! Thank you so much for sharing this feeling of personal growth with us. It is great to hear that you meditate by self-observing your emotional and mental states. Hope you will continue meditating with us and experience being in the present moment. Wish you a great day :) All the best, İpek - Member Happiness"
19,2018-06-29 05:14:12,5,"This app is great if you want to start meditating but are always lazy to do so. When I started I tried just listening to nature sounds on you tube. But this app is so much better you can set your own time, pic the background noise, and the lady speaks to you. It’s very calming. I highly recommend.🧘🏾‍♀️",
20,2019-07-14 12:59:59,5,"I can never stress enough how much this app has helped. I usually never write reviews but i had to on this one. To the people who developed this app i would like to thank you from the bottom of my heart for helping both me, and thousands of other people.","Thank you so much for your sharing. You made us very happy :) If you need anything, you can reach us via hello@meditopia.com Wish you great week! All the best, Seher - Member Happiness"
21,2020-06-17 17:37:34,5,"All this pandemic situation made me look ways to be relief so I found Meditopia I can’t end a day without meditation. It is relaxing, it makes you discover your inner to control your emotions so emotions do not control you. The voice is relaxing specially to sleep, Many times i felt sleep without noticing.",
22,2020-11-09 16:11:26,4,I would definitely give five stars if they had more than one person do the meditations. Unfortunately there is only one woman who does all of them and I don’t personally like her meditation style so I have to take away a star. The other four stars are for the music meditations which are really amazing.,"Thank you so much for this precious feedback! It's been delivered to our team. Hope you keep enjoying all the content with a loth of insight. All the best, İpek - Member Happiness"
23,2020-02-03 05:48:27,5,"This is a very motivational, peaceful app. The meditation practices make you feel more relaxed and aware of your surroundings. Gives you multiple choices and daily great videos. I highly recommend that you get this app. Everything is free too.","Hello, it is great to hear that you liked Meditopia. I hope you will have very relaxing, calming, and soothing meditation experiences with a lot of insight. If you have any questions, you can always reach us via hello@meditopia.com, we are always ready to help. Hope you enjoy! All the best, İpek - Member Happiness"
24,2020-07-11 03:03:48,5,"I bought a year long of premium and I absolutely adore each meditation session. It somehow seems to give me exactly what I need in the moment. Each session is fulfilling, and brings me peace. 100% worth downloading even if you’re only using the base app.","Thank you so much for sharing your profound understanding and warm feelings. It is great to hear that meditation responds to your needs :) I hope you keep enjoying with wonderful meditation experiences. Take care! All the best, İpek - Member Happiness"
25,2020-07-03 02:40:21,4,"I have been through some spiritual doctrine. Listening to these words during meditation, ı can say that they were well thought and aligned. Only con that i can say is it can be easier to find the last meditation you did before and do the next one.
Thanks for how you contributed to our lives in a gentle way.","Thank you so much for sharing these deep ideas with us. I hope you will keep enjoying Meditopia in your journey of self-discovery. The last meditation series we did appear on the Today page of the app. Moreover, you can check day by day your history of meditation on the Profile page, My Journey option. Wish you a great day :) All the best, İpek - Member Happiness "
26,2020-02-08 13:25:42,5,"This app is amazing. They have series of meditations on different topics and have a new meditation topic every day. I really enjoy using the app, and it is helping me start a meditation practice because I choose from a number of different options.","Hello, it is great to hear that you enjoy Meditopia! I hope you will have many calming and insightful meditation experiences :) If you have any questions, you can always reach us via hello@meditopia.com, we are always ready to help you! All the best, İpek - Member Happiness"
27,2020-04-06 10:09:11,1,"So I downloaded this app thinking i could try it out to see how I liked it before the free trial ran out? Not a chance. A day later, I was charged $70 for the app, for the whole year. Nowhere did it state that it would take that amount of money out, just $6 and some change per month. Unless you really have the money so spend, it’s definitely not worth it. Apple was so great with giving me a refund, but the maker of this app needs to be more specific on the charges.","Hello, it is great to hear that you are interested in meditation :) In order for us to check your membership status, you can always reach us via hello@meditopia.com, we are ready to help! Hope you enjoy with wonderful meditation experiences. All the best, İpek - Member Happiness"
28,2019-10-26 20:42:56,1,"I downloaded the free app and looked at it for a minute and decided I didn’t want it and deleted it off of my phone. I never signed up for a subscription but wound up being charged for a monthly premium subscription days later. 
It seems that by downloading the app signs you up for a subscription that will then charge you monthly so please be aware and make sure to cancel the subscription and not just the app from your phone.","Hello, hope you are having a great day! We have free and paid version. When you first download the app, you start with free membership. If you subscribe to Premium membership and not cancel within trial period, membership starts and money is charged. There is no other way that money can be taken unless you register for Premium. If you need anything, you can always reach us via hello@meditopia.com All the best, Seher - Member Happiness"
29,2020-03-31 05:00:59,1,"I tried this every night and it never helps me. If anything, it makes me more tense. First off, you have to pay for almost all the lessons. The voices of the people really annoys me and makes it hard to concentrate on sleeping or whatever I’m trying to do. Lastly, I don’t like the layout of the app. To wrap this review up, I would like to be able to just listen to the sounds and not the voice. A different layout for the app. More lessons that don’t need to be paid for.","Hello, it is great to hear that you are interested in meditation. We have both free and paid subscriptions. You can listen unlocked meditations without any payment. Moreover, if you share the app with your friends, you can gain 2 weeks gift Premium membership. I hope you will discover the content that is best for you among our various meditations, sounds, and articles. If you have any questions, you can always reach us via hello@meditopia.com. 
We are always ready to help. Keep safe and healthy! All the best, İpek - Member Happiness"
30,2020-03-20 14:56:55,5,Had issues with focus and anxiety before using Meditopia. Now I see the difference after a month of every day meditating with this app. Emotionally I am in a different level and much stronger.,"Hello, it is great to hear that you liked Meditopia. I hope you will have very relaxing, calming, and soothing meditation experiences with a lot of insight. If you have any questions, you can always reach us via hello@meditopia.com, we are always ready to help. Hope you enjoy! All the best, İpek - Member Happiness"
31,2020-06-18 13:36:22,5,"Everything it’s amazing, you guys have all organized in a way that we can easy work in our specific situation. 

I can see and feel the love in this app, in all this content 

Thank you so much.","Thank you so much for this warm-hearted comment :) It is great to feel that our positive feelings are shared by our precious members. Hope you will have wonderful meditation experiences. All the best, İpek - Member Happiness"
32,2020-06-17 18:11:18,5,I was at a point where my emotions had the best of me and this App has really taught me to slow down and not be so hard on my self. I feel so much more relaxed and at ease now. Highly recommend it,"Hello, thank you for comment :)  I felt really happy about your experiences. Wish you deeper meditations as you continue! Take care, All the best, Seher - Member Happiness"
33,2020-06-17 06:18:44,5,I’ve been using Meditopia for over three months now and I already feel so different. Morning meditations are my daily routine now and I totally feel different. I highly suggest to everyone who wishes to start meditation.,
34,2020-07-20 00:55:26,1,"I’ve only had this app a few days. I marked my calendar for July 20 to cancel before it started charging me in case I didn’t use it. I used the app a couple times and decided I’d better delete it because i wasn’t using it. I went to settings and canceled it and instead, it charged me. Others complained about this same business practice but I gave you the benefit of the doubt and you charged me. Please refund.","Hello, we are sorry to hear that you had trouble in cancelling your trial. When the memberships are cancelled during the trial period, Apple does not start the paid membership. Most probably, there was a problem in the cancellation steps or in the timing of your cancellation. We would be glad to help you. Can you please reach us through hello@meditopia.com? So that we can check your subscription status. All the best, İpek - Member Happiness"
35,2020-06-19 11:02:13,5,"Whenever I felt stressed at work or felt anxious about what’s going on, I immediately go in and pick a meditation and it feels very calming within minutes. I highly recommend this app as an investment in one’s mental health and wellness 💜",
36,2019-04-09 19:01:43,5,"I am in love with this App. Thanks to all who worked on it. 
Thanks for helping us to calm down and understand that nothing matter in this life but ourselves. 
I deserve to give myself this quality time. Thank you again.","""Giving yourself quality time"", this made us so happy! Thank you so much for sharing. Hope you enjoy more every passing day! Wish you a great day, All the best, Seher - Member Happiness"
